{
  "performance_id": "PERF-HIST-0012",
  "publish_id": "PUB-HIST-0012",
  "task_id": "TASK-NB-20260918-006",
  "window_hours": 72,
  "collected_at": "2026-08-10T12:00:00Z",
  "metrics": {
    "views": 5152,
    "likes": 511,
    "comments": 76,
    "saves": 255,
    "shares": 127,
    "clicks": null,
    "conversion": null,
    "revenue": null
  },
  "engagement_rate": null,
  "source": "synthetic（机制验证数据集）",
  "created_at": "2026-09-18T08:38:43.247827Z"
}
