{
  "performance_id": "PERF-20260918-0001",
  "publish_id": "PUB-20260918-0001",
  "task_id": "TASK-NB-20260918-002",
  "window_hours": 72,
  "collected_at": "2026-09-15T10:00:00Z",
  "metrics": {
    "views": 4200,
    "likes": 156,
    "comments": 23,
    "saves": 89,
    "shares": 41,
    "clicks": null,
    "conversion": null,
    "revenue": 800
  },
  "engagement_rate": null,
  "source": "人工录入（平台导出）",
  "created_at": "2026-09-18T07:00:00Z"
}